id,conversation_id,created_at,date,time,timezone,user_id,username,name,place,tweet,language,mentions,urls,photos,replies_count,retweets_count,likes_count,hashtags,cashtags,link,retweet,quote_url,video,near,geo,source,user_rt_id,user_rt,retweet_id,reply_to,retweet_date,translate,trans_src,trans_dest
1273026875464564737,1273026875464564737,1592348233000,2020-06-16,19:57:13,-0300,1158813209593307136,hideraldo_costa,Hideraldo Costa,,"@marceloramosam 
URGENTE: VAMOS DERRUBAR O VETO AO PL368!
Exmo sr Deputado,
Honrado em cumprimenta-lo, solicito o voto de V. Exa. em favor da derrubada do Veto Presidencial 10, que trata da Regulamentação da Profissão de Historiador (PLS 368/2009 -",pt,['marceloramosam'],[],[],0,1,1,[],[],https://twitter.com/hideraldo_costa/status/1273026875464564737,False,,0,,,,,,,"[{'user_id': '1158813209593307136', 'username': 'hideraldo_costa'}, {'user_id': '42228966', 'username': 'marceloramosam'}]",,,,
1273003436796194820,1273003436796194820,1592342645000,2020-06-16,18:24:05,-0300,139704156,anpuh,ANPUH-BRASIL #derrubaovetopl368,,"URGENTE - Fixado em nosso perfil um modelo de mensagem que todos e todas podemos enviar ainda hoje aos nossos deputados e senadores, em particular aos presidentes da Câmara @RodrigoMaia e do Senado @davialcolumbre. Pedindo a derrubado do veto ao PL368.",pt,"['rodrigomaia', 'davialcolumbre']",[],[],2,16,47,[],[],https://twitter.com/ANPUH/status/1273003436796194820,False,,0,,,,,,,"[{'user_id': '139704156', 'username': 'ANPUH'}, {'user_id': '35260027', 'username': 'RodrigoMaia'}, {'user_id': '2716763753', 'username': 'davialcolumbre'}]",,,,
1256328434369757184,1256328432901738496,1588367014000,2020-05-01,18:03:34,-0300,1174424361421410304,saladazul,KILLED THE CZAR AND HIS MINISTERS,,"da memória de nossa sociedade. 
O veto da PL368 é um retrocesso vergonhoso, é falta de compromisso com a verdade, falta de respeito com a memória de todo um povo.
#1maio #historiadoraétrabalhadora #historiadoretrabalhador #anpuh #derrubaovetopl368",pt,[],[],[],1,0,3,"['#1maio', '#historiadoraétrabalhadora', '#historiadoretrabalhador', '#anpuh', '#derrubaovetopl368']",[],https://twitter.com/saladazul/status/1256328434369757184,False,,0,,,,,,,"[{'user_id': '1174424361421410304', 'username': 'saladazul'}]",,,,
1255912849890848771,1255912849890848771,1588267931000,2020-04-30,14:32:11,-0300,257656397,suavementereco,Suavemente recolhida...,,Eu apenas um bebê ministrando aula na UEMA em 2013. Nossa! Deu até saudade da sala de aula! #tbt #derrubaovetopl368 #vetopl368  pic.twitter.com/0OUe8HaGkc,pt,[],[],['https://pbs.twimg.com/media/EW3mEyJXkAUUe8J.jpg'],0,0,1,"['#tbt', '#derrubaovetopl368', '#vetopl368']",[],https://twitter.com/suavementereco/status/1255912849890848771,False,,0,,,,,,,"[{'user_id': '257656397', 'username': 'suavementereco'}]",,,,
661520494798241792,661520494798241792,1446553751000,2015-11-03,09:29:11,-0300,376387713,assembleiasc,ALESC,,"CCJ admite MSV 276/15: veto total ao PL368/13, de @neodisaretta => estratégias de conscientização acerca dos problemas de saúde do homem.",pt,[],[],[],0,0,0,[],[],https://twitter.com/assembleiasc/status/661520494798241792,False,,0,,,,,,,"[{'user_id': '376387713', 'username': 'assembleiasc'}]",,,,
